id,statusColor,statusIcon,assigned_office_id,assigned_office_name,follow_up,source,ticket_number,assigned_for_information_purpose,form_name,created_at_nepali,created_at,status,complain_type,complain_type_text,complain_type_color,form_details,actions
83222,#33A34F,done_all,12.0,"संस्कृति, पर्यटन तथा नागरिक उड्डयन मन्त्रालय",0,what's app,HS-WEB-83222,0,पर्यटकसंग सम्बन्धित,"८ जेठ २०८२, बिहिवार (11:29:20 PM)",2025-05-22 23:29:20,CLOSED,HIGHLY URGENT,#DC3545,#FAE1E3,"{'गुनासो/उजुरीको संक्षिप्त विवरण': ""Subject: Enhancing Nepal’s Tourism Policies and Airport Facilities\r\n\r\nI hope this message finds you in good health and high spirits. I am writing to bring to your esteemed attention two significant proposals that have the potential to enhance Nepal’s tourism experience, strengthen the bond between Non-Resident Nepalis (NRNs) and their homeland, and improve the comfort of families traveling through Nepal’s airports.\r\n1. Free Visa Provisions for Non-Resident Nepali (NRN) Citizens  As an NRN, I deeply value the cultural and economic connections we maintain with Nepal. NRNs across the globe play an instrumental role in promoting Nepal internationally, fostering investment, and contributing to its economic growth. Introducing a free visa policy for NRN citizens would not only encourage more frequent visits but also reinforce our commitment to supporting Nepal’s prosperity. This initiative would serve as a heartfelt acknowledgment of NRNs' contributions and strengthen their emotional and financial ties with their homeland. By making travel more accessible, Nepal can further engage its global diaspora and encourage them to actively participate in various developmental and cultural initiatives.\r\n2. Establishment of Baby Changing Rooms at Tribhuvan International Airport and Other Airports  Nepal’s reputation as a welcoming destination can be further enhanced by improving airport facilities for families traveling with infants and young children. Currently, there is a noticeable lack of designated baby changing rooms at Tribhuvan International Airport (TIA) and other airports, which poses significant challenges for parents and caregivers. Ensuring well-equipped, hygienic, and private baby changing rooms would greatly enhance the convenience and comfort of families, making Nepal’s airports more accommodating for international and domestic travelers alike. Investing in such infrastructure would reflect Nepal’s dedication to providing a seamless and family-friendly travel experience.\r\nI strongly believe that implementing these initiatives would not only benefit NRNs but also elevate Nepal’s standing as a progressive and visitor-friendly nation. Your leadership and support in addressing these concerns would be greatly appreciated by Nepalese expatriates, tourists, and families traveling through our airports.\r\nThank you for your time and thoughtful consideration. I look forward to your response and remain hopeful that these proposals will be positively received."", 'गुनासोको प्रकृति': 'अन्य', 'समस्या सिर्जनाकर्ता': 'नेपाल सरकार', 'समस्या सिर्जना भएको स्थान': {'city': 'काठमाण्डौ महानगरपालिका', 'state': 'वागमति प्रदेश (प्रदेश नं. 3)', 'district': 'काठमाडौं'}}","[{'id': 465167, 'created_at': '2025-05-22 23:29:20', 'created_at_nepali': '८ जेठ २०८२, बिहिवार 11:29 PM', 'action_type': {'icon': 'visibility_off', 'name': 'NOT SEEN', 'color': '#F44336', 'status': 0}, 'description': None, 'file': None, 'message': 'N/A', 'notification_for': None, 'public_response': None, 'complain_id': 83222}, {'id': 465512, 'created_at': '2025-05-23 13:46:52', 'created_at_nepali': '९ जेठ २०८२, शुक्रवार 01:46 PM', 'action_type': {'icon': 'done', 'name': 'SOLVED', 'color': '#33A34F', 'status': 3}, 'description': 'सम्बन्धित निकायमा पठाइएको बारे', 'file': 'uploads/CXKNJ4Z89nSPHYo8Z17x3rPoaLPosUxduucfOau3.pdf', 'message': 'N/A', 'notification_for': None, 'public_response': 'सम्बन्धित निकायमा पठाइएको बारे', 'complain_id': 83222}, {'id': 465555, 'created_at': '2025-05-23 14:03:05', 'created_at_nepali': '९ जेठ २०८२, शुक्रवार 02:03 PM', 'action_type': {'icon': 'done_all', 'name': 'CLOSED', 'color': '#33A34F', 'status': 19}, 'description': 'मितिः 208२/0२/०८ नेपाल सम्वत्: 114५, बछलागा, दशमी विषयः गुनासो फर्छ्यौट गर्ने सम्बन्धमा। श्री पर्यटन वोर्ड, रामशाहपथ, काठमाण्डौं । प्रस्तुत विषयमा प्रधानमन्त्री तथा मन्त्रिपरिषद्को कार्यालय, हेलो सरकार पोर्टलमार्फत प्राप्त तहाँसँग सम्बन्धित गुनासो (टिकट नं. HS-WEB-८०७२७) समेटिएको उजुरी पत्रको छाँयाप्रति पाना-१ यसैसाथ संलग्न छ । बेहोरा संलग्न उजुरीबाट अवगत गर्नु भई फर्छ्यौट गर्न र सम्बन्धित उजुरीकर्तालाई जानकारी दिई सोको प्रतिवेदन मन्त्रालयको उजुरी तथा गुनासो इकाइमा समेत दिने व्यवस्था गर्नुहुन आदेशानुसार अनुरोध छ। सम्बन्धित निकायमा पठाइएको बारे', 'file': None, 'message': 'N/A', 'notification_for': None, 'public_response': 'मितिः 208२/0२/०८ नेपाल सम्वत्: 114५, बछलागा, दशमी विषयः गुनासो फर्छ्यौट गर्ने सम्बन्धमा। श्री पर्यटन वोर्ड, रामशाहपथ, काठमाण्डौं । प्रस्तुत विषयमा प्रधानमन्त्री तथा मन्त्रिपरिषद्को कार्यालय, हेलो सरकार पोर्टलमार्फत प्राप्त तहाँसँग सम्बन्धित गुनासो (टिकट नं. HS-WEB-८०७२७) समेटिएको उजुरी पत्रको छाँयाप्रति पाना-१ यसैसाथ संलग्न छ । बेहोरा संलग्न उजुरीबाट अवगत गर्नु भई फर्छ्यौट गर्न र सम्बन्धित उजुरीकर्तालाई जानकारी दिई सोको प्रतिवेदन मन्त्रालयको उजुरी तथा गुनासो इकाइमा समेत दिने व्यवस्था गर्नुहुन आदेशानुसार अनुरोध छ। सम्बन्धित निकायमा पठाइएको बारे', 'complain_id': 83222}]"
83215,#11AEBA,autorenew,4021.0,मुख्यमन्त्री तथा मन्त्रिपरिषद्को कार्यालय मधेश,0,what's app,HS-WEB-83215,0,सुझाव सम्बन्धी,"८ जेठ २०८२, बिहिवार (09:43:23 PM)",2025-05-22 21:43:23,PROCESSING,HIGHLY URGENT,#DC3545,#FAE1E3,"{'सम्बन्धित कागजात (छ भने)': 'storage/uploads/682f499ec9c26_WhatsApp_Image_2025-05-22_at_21.35.51_080328b3.jpg', 'सुझावको प्रकृति': 'कार्यप्रणालीमा सुधारका लागि सुझाव'}","[{'id': 465152, 'created_at': '2025-05-22 21:43:23', 'created_at_nepali': '८ जेठ २०८२, बिहिवार 09:43 PM', 'action_type': {'icon': 'visibility_off', 'name': 'NOT SEEN', 'color': '#F44336', 'status': 0}, 'description': 'तपाइको गुनासो ध्यानाकर्षणका लागि सम्बन्धित निकायमा पठाइएको छ। धन्यवाद ।', 'file': None, 'message': 'N/A', 'notification_for': None, 'public_response': 'तपाइको गुनासो ध्यानाकर्षणका लागि सम्बन्धित निकायमा पठाइएको छ। धन्यवाद ।', 'complain_id': 83215}, {'id': 467516, 'created_at': '2025-05-26 14:24:36', 'created_at_nepali': '१२ जेठ २०८२, सोमवार 02:24 PM', 'action_type': {'icon': 'done', 'name': 'SOLVED', 'color': '#33A34F', 'status': 3}, 'description': 'यस आयोगको कार्यक्षेत्रसंग सम्बन्धित देखिएन /', 'file': None, 'message': 'N/A', 'notification_for': None, 'public_response': 'यस आयोगको कार्यक्षेत्रसंग सम्बन्धित देखिएन /', 'complain_id': 83215}, {'id': 467931, 'created_at': '2025-05-27 09:33:51', 'created_at_nepali': '१३ जेठ २०८२, मङ्गलवार 09:33 AM', 'action_type': {'icon': 'visibility_off', 'name': 'RE-ASSIGNED/UNSEEN', 'color': '#FAA64B', 'status': 9}, 'description': 'तपाइको गुनासो ध्यानाकर्षणका लागि सम्बन्धित निकायमा पठाइएको छ। धन्यवाद ।', 'file': None, 'message': 'N/A', 'notification_for': None, 'public_response': 'तपाइको गुनासो ध्यानाकर्षणका लागि सम्बन्धित निकायमा पठाइएको छ। धन्यवाद ।', 'complain_id': 83215}, {'id': 482558, 'created_at': '2025-06-18 10:57:27', 'created_at_nepali': '४ असार २०८२, बुधवार 10:57 AM', 'action_type': {'icon': 'autorenew', 'name': 'PROCESSING', 'color': '#11AEBA', 'status': 2}, 'description': 'गुनासो व्यवस्थापनको लागी स्वास्थ्य तथा जनसंख्या मन्त्रालय मधेश प्रदेशलाई यस कार्यालयको मिति 2082/02/27 गते च.नं. 3729 बाट लेखि उठाएको।', 'file': None, 'message': 'N/A', 'notification_for': None, 'public_response': 'गुनासो व्यवस्थापनको लागी स्वास्थ्य तथा जनसंख्या मन्त्रालय मधेश प्रदेशलाई यस कार्यालयको मिति 2082/02/27 गते च.नं. 3729 बाट लेखि उठाएको।', 'complain_id': 83215}]"
74259,#33A34F,done_all,19.0,स्वास्थ्य तथा जनसंख्या मन्त्रालय,0,National Call,HS-62988-74259,1,स्वास्थ्य चौकी/अस्पतालसंग सम्बन्धी,"१८ पुष २०८१, बिहिवार (12:43:48 PM)",2025-01-02 12:43:48,CLOSED,URGENT,#FFAE00,#FEF2D9,"{'गुनासो/उजुरीको संक्षिप्त विवरण': 'स्वास्थ्य बिमा लागू नहुदा उपचारमा कठिनाई परेको', 'स्वास्थ्य चौकी/अस्पतालको नाम': 'गंगालाल हृदयरोग अस्पताल', 'स्वास्थ्य चौकी /अस्पतालको  ठेगाना': {'city': 'काठमाण्डौ महानगरपालिका', 'state': 'वागमति प्रदेश (प्रदेश नं. 3)', 'district': 'काठमाडौं', 'ward': '18'}, 'औषधि अभाव हुनुको कारण': 'अन्य'}","[{'id': 403042, 'created_at': '2024-12-12 21:56:42', 'created_at_nepali': '२७ मंसिर २०८१, बिहिवार 09:56 PM', 'action_type': {'icon': 'chat_bubble', 'name': 'COMMENT FROM CALL CENTER', 'color': '#0F76BC', 'status': 4}, 'description': 'आवश्यक कारवाहीका लागि सम्बन्धित निकायमा पठाइएको छ | धन्यवाद |', 'file': None, 'message': 'N/A', 'notification_for': None, 'public_response': 'आवश्यक कारवाहीका लागि सम्बन्धित निकायमा पठाइएको छ | धन्यवाद |', 'complain_id': 74259}, {'id': 408930, 'created_at': '2025-01-02 12:43:48', 'created_at_nepali': '१८ पुष २०८१, बिहिवार 12:43 PM', 'action_type': {'icon': 'visibility_off', 'name': 'RE-ASSIGNED/UNSEEN', 'color': '#FAA64B', 'status': 9}, 'description': 'तपाइको गुनासो ध्यानाकर्षणका लागि सम्बन्धित निकायमा पठाइएको छ।  धन्यवाद ।', 'file': None, 'message': 'N/A', 'notification_for': None, 'public_response': 'तपाइको गुनासो ध्यानाकर्षणका लागि सम्बन्धित निकायमा पठाइएको छ।  धन्यवाद ।', 'complain_id': 74259}, {'id': 425025, 'created_at': '2025-02-11 11:58:49', 'created_at_nepali': '२९ माघ २०८१, मङ्गलवार 11:58 AM', 'action_type': {'icon': 'autorenew', 'name': 'PROCESSING', 'color': '#11AEBA', 'status': 2}, 'description': 'पत्राचार गरिएको', 'file': '[]', 'message': 'N/A', 'notification_for': None, 'public_response': 'पत्राचार गरिएको', 'complain_id': 74259}, {'id': 425026, 'created_at': '2025-02-11 11:59:01', 'created_at_nepali': '२९ माघ २०८१, मङ्गलवार 11:59 AM', 'action_type': {'icon': 'autorenew', 'name': 'PROCESSING', 'color': '#11AEBA', 'status': 2}, 'description': 'पत्राचार गरिएको', 'file': '[""uploads\\/actions\\/file\\/ad72510f6045f5c950a9575662cdd2a8.jpg""]', 'message': 'N/A', 'notification_for': None, 'public_response': 'पत्राचार गरिएको', 'complain_id': 74259}, {'id': 500652, 'created_at': '2025-07-15 11:04:25', 'created_at_nepali': '३१ असार २०८२, मङ्गलवार 11:04 AM', 'action_type': {'icon': 'done', 'name': 'SOLVED', 'color': '#33A34F', 'status': 3}, 'description': 'गुनासोकर्ताज्यू हाल जानकारी लिंदा सो अवस्था नभको सूचना प्राप्त भएको अनुरोध गर्दछौँ........सेवाहरु नियमित सुचारु भएको जानकारी प्राप्त भएको छ ....... .... सुचना प्रवाहमा ढिलाई भएकोले क्षमा प्रार्थी छौ ......... आगामी दिनमा पठाउनु भएको गुनासो ढिलाई गरिने छैन।।। गुनासो भएमा पुन पठाउनुहुन अनुरोध गर्दछौँ MOHP थप जानकारीका लागि स्वास्थ्य वीमा बोर्ड •\tयस सम्बन्धमा स्वास्थ्य वीमा वोर्डको सम्पर्क नम्बर  +९७७ -०१ -४१००२२३/४१००२२४/४१००२२५\r\n•\t १६६००१११२२४\r\n•\t +९७७ -०१ -४१००२२३\r\n•\t https://mail.nepal.gov.np/\r\n•\t info@hib.gov.np', 'file': None, 'message': 'N/A', 'notification_for': None, 'public_response': 'गुनासोकर्ताज्यू हाल जानकारी लिंदा सो अवस्था नभको सूचना प्राप्त भएको अनुरोध गर्दछौँ........सेवाहरु नियमित सुचारु भएको जानकारी प्राप्त भएको छ ....... .... सुचना प्रवाहमा ढिलाई भएकोले क्षमा प्रार्थी छौ ......... आगामी दिनमा पठाउनु भएको गुनासो ढिलाई गरिने छैन।।। गुनासो भएमा पुन पठाउनुहुन अनुरोध गर्दछौँ MOHP थप जानकारीका लागि स्वास्थ्य वीमा बोर्ड •\tयस सम्बन्धमा स्वास्थ्य वीमा वोर्डको सम्पर्क नम्बर  +९७७ -०१ -४१००२२३/४१००२२४/४१००२२५\r\n•\t १६६००१११२२४\r\n•\t +९७७ -०१ -४१००२२३\r\n•\t https://mail.nepal.gov.np/\r\n•\t info@hib.gov.np', 'complain_id': 74259}, {'id': 500969, 'created_at': '2025-07-15 13:16:58', 'created_at_nepali': '३१ असार २०८२, मङ्गलवार 01:16 PM', 'action_type': {'icon': 'done_all', 'name': 'CLOSED', 'color': '#33A34F', 'status': 19}, 'description': 'स्वास्थ्य मन्त्रालयबाट हाल जानकारी लिंदा सो अवस्था नभको सूचना प्राप्त भएको र सेवाहरु नियमित सुचारु भएको जानकारी प्राप्त भएको छ', 'file': None, 'message': 'N/A', 'notification_for': None, 'public_response': 'स्वास्थ्य मन्त्रालयबाट हाल जानकारी लिंदा सो अवस्था नभको सूचना प्राप्त भएको र सेवाहरु नियमित सुचारु भएको जानकारी प्राप्त भएको छ', 'complain_id': 74259}]"
73063,#11AEBA,autorenew,31.0,अर्थ मन्त्रालय,0,Website,HS-WEB-73063,0,युवा खेलकुद सम्बन्धी,"२ मंसिर २०८१, आइतवार (10:22:38 AM)",2024-11-17 10:22:38,PROCESSING,URGENT,#FFAE00,#FEF2D9,"{'गुनासो/उजुरीको संक्षिप्त विवरण': 'युवा तथा साना व्यावसायी स्वरोजगार कोषमा रिक्त उपाध्यक्ष नियुक्त नहुनुको कारण के होला ? जस कारणले गर्दा धेरै कुराको समस्या देखियो ।', 'गुनासोको प्रकार': 'अन्य', 'समस्या सिर्जनाकर्ताको ठेगाना': {'city': 'काठमाण्डौ महानगरपालिका', 'state': 'वागमति प्रदेश (प्रदेश नं. 3)', 'district': 'काठमाडौं', 'ward': '4'}}","[{'id': 394459, 'created_at': '2024-11-17 10:22:38', 'created_at_nepali': '२ मंसिर २०८१, आइतवार 10:22 AM', 'action_type': {'icon': 'visibility_off', 'name': 'RE-ASSIGNED/UNSEEN', 'color': '#FAA64B', 'status': 9}, 'description': 'तपाइको गुनासो ध्यानाकर्षणका लागि सम्बन्धित निकायमा पठाइएको छ।  धन्यवाद ।', 'file': None, 'message': 'N/A', 'notification_for': None, 'public_response': 'तपाइको गुनासो ध्यानाकर्षणका लागि सम्बन्धित निकायमा पठाइएको छ।  धन्यवाद ।', 'complain_id': 73063}, {'id': 398676, 'created_at': '2024-12-01 09:59:36', 'created_at_nepali': '१६ मंसिर २०८१, आइतवार 09:59 AM', 'action_type': {'icon': 'autorenew', 'name': 'PROCESSING', 'color': '#11AEBA', 'status': 2}, 'description': 'आवश्यक कार्याथ सम्बन्धितमा पठाइसकेको', 'file': '[]', 'message': 'N/A', 'notification_for': None, 'public_response': 'आवश्यक कार्याथ सम्बन्धितमा पठाइसकेको', 'complain_id': 73063}]"
